,pesna,year_from,year_to,song_name,zbirka_name,podzbirka_name
0,спомен ми останаа во умот белите магли и една пуста есен по нашите полиња бегаше возот наврнат жално рикаше бегаа селата есенски од мене и ридје голи тонеа во далечината беше расплакана кална приквечерина чад ми влегуваше в гради за тебе мислев земјо татковино тага се склучка в гради како да не бидам тажен штом гледам што е нашево сега нашено минато бакалски носеј пробесени бечви процовцани унечки измацани селански очи тресливи раце испукани умој исчукани вратој наструпени глави ничкум наведени а тие деца пргави на света борба ветени потурнати поплукани на раскрсници крвави умирале ужасени тие на небо пустелинско од темнината штрекнати метеори угасени бегаше возот тогаш наврнат рикаше во темницата така рикаше мака во мене дека сум роден во згазено племе и зошто сега пак љубов ме враќа кај тебе земјо песочлива длабоко в душа остана спомен за бели магли по нашите полиња за песна од налани по нашите калдрми,1941,1945,ПЕСНА ЗА ЖИВОТОТ,ОД СТАРИОТ НОТЕС (1941‡1945),ОД СТАРИОТ НОТЕС (1941‡1945)
1,премала понекогаш му доаѓа на човека да се загреви над себеси се гледа како отстрана и самиот себе се жала кутриот и овој уште нешто сака уште нешто плетка чувај се од таква премала човече ти не си роден тукутака води сметка,1941,1945,ПЕСНА ЗА ЖИВОТОТ,ОД СТАРИОТ НОТЕС (1941‡1945),ОД СТАРИОТ НОТЕС (1941‡1945)
2,селски пат таа патека тесна и кривуличава ја провирам како конец низ игла во мојот спомен сега ме води по каменици еве ме стасав и до чешмата тука е отепан соколе наш во пусто турско го протнав патчето сè до сивец оттука веќе се гледа долу небрегово,1941,1945,ПЕСНА ЗА ЖИВОТОТ,ОД СТАРИОТ НОТЕС (1941‡1945),ОД СТАРИОТ НОТЕС (1941‡1945)
3,немош тоа се случува така со секого со човек со птица со волк последен порив последен повик последен подем или полет потоа пад и молк плачат во мене последните десет години на исцрпување од возбуди и болка што клука липаат како напуштени деца сами пред замандалена порта на која со голи раце немошта чука,1941,1945,ПЕСНА ЗА ЖИВОТОТ,ОД СТАРИОТ НОТЕС (1941‡1945),ОД СТАРИОТ НОТЕС (1941‡1945)
4,знак љубов на врвот на мојата липа денеска дури две птици тихо се лелеат една спроти друга спрема синото небо на две гранчиња тоа иде како звук од далечна флејта сега тоа не е еден сокол ами две милни гугучки,1941,1945,ПЕСНА ЗА ЖИВОТОТ,ОД СТАРИОТ НОТЕС (1941‡1945),ОД СТАРИОТ НОТЕС (1941‡1945)
5,многу жал ми падна многу црна мака за твојата младост дека загина силно момче беше силно срце в гради не истрпе срце ропство да го јади ти нарами пушка одбор чета собра и планина вати гора зелена те издемна душман во злоба утаен за отплата вика гробот твој незнаен,1941,1945,ПЕСНА ЗА ЖИВОТОТ,ОД СТАРИОТ НОТЕС (1941‡1945),ОД СТАРИОТ НОТЕС (1941‡1945)
6,ревматизам еден анѓел бие со глето во моето десно колено јас удирам не да те закрепнам вели тој јас удирам дека ми е наредено заповедано мене ми е речено да удирам да мавам да чукам сè на исто место со денови и со години јас сум заморен од таа еднолична работа прости ми те молам ако боли,1941,1945,ПЕСНА ЗА ЖИВОТОТ,ОД СТАРИОТ НОТЕС (1941‡1945),ОД СТАРИОТ НОТЕС (1941‡1945)
7,по мразовите сурова зима испомрзнаа толку дрвчиња грмушки ги попари мразот во дојран зокумите катмерестите студен сек рез и што понатаму ќе жугнат пак негдегоде со непромислен животен сок нови подници од корењата,1941,1945,ПЕСНА ЗА ЖИВОТОТ,ОД СТАРИОТ НОТЕС (1941‡1945),ОД СТАРИОТ НОТЕС (1941‡1945)
8,шар планина и во идниот живот ќе те носам тебе во погледот снежен љуботенски вису зашто се плашам можеби безрасудно дека никој веќе нема да ја сети во целата вечност олку остро оваа бела убавина како мене сега во сончев неделен ден во светиниколскиот месец,1941,1945,ПЕСНА ЗА ЖИВОТОТ,ОД СТАРИОТ НОТЕС (1941‡1945),ОД СТАРИОТ НОТЕС (1941‡1945)
9,во gодина gо разбунtува карpош pроtив беgовиtе кумановскиоt крај оган ја разгоре ноќта пушки немирници ѕунат народе стануј збирај се војско буна се крева буна карпош од карадаг слезе од село в село ита планински виор ги разлулеа зрелите в поле жита народе стануј збирај се војско рипај машчио сиромашчио голабоса грабај кој има кременарка кој нема ластегарка сор и коса удри го бејското племе темник нека го земе виор в пустелија нека го расее пчошкото семе каде поганци од кулите сосе пискулите и булите нема да куртулите крвав ви иде еремија в десница сабја му трешница в левица гламна горешница страшна е раката што плаќа за маката зора зазорува а по сите патје идат лути сватје чекај кумановски граде ќе тропнат на твојте вратје отворај визби амбари токми дарови карпош ти води свадбари буно карпошова селанска веселбо црвено вино црвена крв на пат се лее јуначка песна се пее на крала кралство ќе земеме на цара царство ќе земеме земја ќе ослободиме идат а крај пат на сув брест качен зијабег на високо на рамо гаргач држи место сокол зијо змијо на капина префрлена еве ти за белите што ги чинеше душата што ни ја кинеше еве ти за беделите за кулуците по неделите идат барјак крвавее пушки ѕунат народе стануј збирај се војско буна се крева буна,1941,1945,ПЕСНА ЗА ЖИВОТОТ,ОД СТАРИОТ НОТЕС (1941‡1945),ОД СТАРИОТ НОТЕС (1941‡1945)
10,видување дошол стрико петруш од дреновци кондисал кај евремовци нели го прават митроен еј од кога не е дојден од оломнани го фатил далак кутриот д одиме да го видиме сега е време да се скрши некој лаф со него оти што знаеш што носи денот што носи ноќта едно видување еден век,1941,1945,ПЕСНА ЗА ЖИВОТОТ,ОД СТАРИОТ НОТЕС (1941‡1945),ОД СТАРИОТ НОТЕС (1941‡1945)
11,хроника на прилеп останавте по патот наши другари и браќа било кај тројаци било кај никодин или на мукос или на прилепец на песјо брдце и каде не испраќајќи нè како со смешка на усните пред да склопите очи и следејќи нè упорно сè довде,1941,1945,ПЕСНА ЗА ЖИВОТОТ,ОД СТАРИОТ НОТЕС (1941‡1945),ОД СТАРИОТ НОТЕС (1941‡1945)
12,смртна песна pосвеtена на н ваpцаров да те изнесат надвор во стресен истинат мрак дош тура засилен надвор и нешто шуми надвор во стресен истинат мрак мирно да поминеш сам пред окрвавено зло ако си спомниш нешто веднаш забóрај го умира секој вик нечуен в темнина и твојот смртен вик нечуен загина,1941,1945,ПЕСНА ЗА ЖИВОТОТ,ОД СТАРИОТ НОТЕС (1941‡1945),ОД СТАРИОТ НОТЕС (1941‡1945)
13,трепет те молам запри не пристапуј близу ме граба веднаш сепобеден ужас и колку да се твојте стапки леки јас страдам божем на срце ми газиш о тоа пат е на тага и есен што рони лисја како тихи солзи и дека уште прва љубов немам те молам запри не пристапуј близу,1941,1945,ПЕСНА ЗА ЖИВОТОТ,ОД СТАРИОТ НОТЕС (1941‡1945),ОД СТАРИОТ НОТЕС (1941‡1945)
14,полноќ загубен жерав в бескраен мрак в бескрај се гласи самотен вик самотен вик од ветрот скршен пред мразни зори уморни крилја тој ќе склопи и ќе доврши незнаен пат в бескрај се гласи самотен вик над мртов град самотен вик о дали има будно срце тагата само и ништо друго бескраен само да сети јад над мразно поле низ темница пискот на сама ранета птица,1941,1945,ПЕСНА ЗА ЖИВОТОТ,ОД СТАРИОТ НОТЕС (1941‡1945),ОД СТАРИОТ НОТЕС (1941‡1945)
15,помош толку стари и млади гледам околу готови да го земат товарот на себе без кимка без надокнада само за да ми помогнат толку отворено и наивно го примаат тие животот без смисла за опасноста а јас пак чемреам и сум паднал во очај крени ја главата окајаниј можеби со таа несебична помош и ти нешто постигаш за иднината,1941,1945,ПЕСНА ЗА ЖИВОТОТ,ОД СТАРИОТ НОТЕС (1941‡1945),ОД СТАРИОТ НОТЕС (1941‡1945)
16,ѕвезди думам вие еднаш ми зборевте нешто но не думам веќе што и како било и залудно да се присетувам сега сивило се свило споменот го скрило думам само беше на полноќ во раец чкртаа по патот кираџиски коли и штуркаа ѕвезди еднолично штурци со глас што се моли за тивнати боли о ѕвездено небо мислев дека мој е зборот како тајна што во мене ѕуни но залудно да се присетувам сега зошто да ме буни звук на глуви струни го паметам само тиквешкиот говор на колари пеши крај чкрипливи коли само она тивко штуркање во раец и глас што се моли за далечни боли,1941,1945,КАМБАНИ,ОД СТАРИОТ НОТЕС (1941‡1945),ОД СТАРИОТ НОТЕС (1941‡1945)
17,песна за животот како лаеле пците како било кално сето ме наваса сега во темничиштево пално крваво време сето си гола измачена мрша со чекан една по една глави бабуњави кршат ииии задишени напред вјасаме не се даваме настрвени ќе касаме,1941,1945,КАМБАНИ,ОД СТАРИОТ НОТЕС (1941‡1945),ОД СТАРИОТ НОТЕС (1941‡1945)
18,преображење нежно ме дели од постелата да не се сетам што станува да не ме доболи да не ми биде тешко кажете ми пат во натамошниот живот правете место за потурнат човек секогаш друга рамка го чека телото со веќе назначен нимб каде што лежам сега на грб тревата била разгазена над мене зелен бор над него сино небо секогаш друга лулка го чека телото да го заниша да го занесе да го приспие така од лулка до гроб,1941,1945,КАМБАНИ,ОД СТАРИОТ НОТЕС (1941‡1945),ОД СТАРИОТ НОТЕС (1941‡1945)
19,резигнација зошто ја чувствуваш оваа тага што срцево го стегнала ледно кога е јасно дека си победен и треба да ти е веќе сè едно треба да бидеш сосема мирен треба да бидеш докрајно мудар да чекаш така без возбуда секаква навреда и удар дури во тоа што се сака не можеш сега да имаш вера странични желби влечат некаде и не е денес што било вчера зошто те стега оваа тага што како магла се шири в гради сега сме сосем беспомошни ние што бевме силни и млади,1941,1945,КАМБАНИ,ОД СТАРИОТ НОТЕС (1941‡1945),ОД СТАРИОТ НОТЕС (1941‡1945)
20,крени се гоце војвода доста си трпел неправди тебе те чека гората тебе те пека полето на нива мачни селани клетите робје в зандани крени се сину народен поведи народ поробен да ни е пролет пролетта да ни е наше полето да ни се мили селата да ни е радост челадта,1941,1945,КАМБАНИ,ОД СТАРИОТ НОТЕС (1941‡1945),ОД СТАРИОТ НОТЕС (1941‡1945)
21,обврска сфати ја со сета сериозност оваа обврска уште посилна дека заемна и без да го знаеш досега тоа ние сме се задолжиле да го чуваме споменот еден за друг ќе минат сите површни оддалечувања ќе дојде час на враќање кон загубеното за да се згрее душата макар малце на него како што изѕемнатиот ги грее рацете на жив жар под распретаната пепел,1941,1945,КАМБАНИ,ОД СТАРИОТ НОТЕС (1941‡1945),ОД СТАРИОТ НОТЕС (1941‡1945)
22,јаглен само да замижам тој веќе расте од подземноста безоки црни грижни старци се исправуваат пред мене нивните чела со строги брчки ми се внесуваат в лице ако ги стиснам посилно клепките црн тој на карпи се трупа веќе ме надраснал ме поклопува крцкаво ме зглобува во себе и јас сум веќе в подземен рудник црна грутка што си шепоти можам да горам,1941,1945,КАМБАНИ,ОД СТАРИОТ НОТЕС (1941‡1945),ОД СТАРИОТ НОТЕС (1941‡1945)
23,сенка оваа лека сенка преку патот што неусетно падна сè уште проѕирна значи веќе вистинска пресуда над денот иако никој и не помислува на тоа таа паѓа како преку душата без никаква тежина само со неусетна нијанса на студ но тоа значи потпис на пресуда над денот по неа иде самрак па мрак,1941,1945,КАМБАНИ,ОД СТАРИОТ НОТЕС (1941‡1945),ОД СТАРИОТ НОТЕС (1941‡1945)
24,очовечување штом тие можеле така да помислат и дури да ми го речат јас не знам што е слободен здив од гради ширно широки целиот свет да загрнат не роди се човек роб биди ами роди се роб и роб биди кочо рацине брате,1941,1945,КАМБАНИ,ОД СТАРИОТ НОТЕС (1941‡1945),ОД СТАРИОТ НОТЕС (1941‡1945)
25,урна ја склопив десната дланка и стискам јако цврсто како својата пепел да сум ја собрал во грстот,1941,1945,КАМБАНИ,ОД СТАРИОТ НОТЕС (1941‡1945),ОД СТАРИОТ НОТЕС (1941‡1945)
26,по многу години по многу години пак се најдов на истата улица во овој град зима е голомразица смрзнат коловозот тротоарите чекор по чекор по многу години пак се најдов на истата улица сум заборавил дека таа куќа е на аголот сум заборавил колку неугледен бил нејзиниот влез не сум сигурен дали тоа се случуваше на вториот или на третиот кат само позлатените раскошни месечински полноќи над истиот овој град ги паметам сè уште сега преминувам со дланка по грапавината на ѕидот тоа е сè што можам да сторам по многу години,1941,1945,КАМБАНИ,ОД СТАРИОТ НОТЕС (1941‡1945),ОД СТАРИОТ НОТЕС (1941‡1945)
27,свежина студено варило чешма во леската под златоврв жуберка водата во дванаесет коритца камени од едно во друго претекува сонце просеано низ клепките ромор во слухот бистер здив што останало животна свежина во мене отаде потекнува,1941,1945,КАМБАНИ,ОД СТАРИОТ НОТЕС (1941‡1945),ОД СТАРИОТ НОТЕС (1941‡1945)
28,кумановскиот превој кога в скопско пченицата трае и ржта молчи во надгробна тага овде е едно брановито море ширина плавна и пучинска песна душата долу таговна и млака овде се дипли сè талас по талас ко што се диплат тие шумни житја пеејќи пливај пливај пливај еј,1941,1945,КАМБАНИ,ОД СТАРИОТ НОТЕС (1941‡1945),ОД СТАРИОТ НОТЕС (1941‡1945)
29,старата старата запира до темната порта не се слуша страшливо се обѕира сè се чини некој се подбива старата запира до темната порта не се види рано на ругузина се свиткува на сон оддалеку со мртвите се надвикува,1941,1945,НОЌНА ПЕСНА,ОД СТАРИОТ НОТЕС (1941‡1945),ОД СТАРИОТ НОТЕС (1941‡1945)
30,промени цела ноќ врне цела ноќ сонот ја преобразува мојата мака се будам и се чудам што беше оваа тежина но веднаш се сеќавам и маката го добива пак своето старо име има толку причини да се сожалуваме уште капе но наскоро може да настапи разведрување,1941,1945,НОЌНА ПЕСНА,ОД СТАРИОТ НОТЕС (1941‡1945),ОД СТАРИОТ НОТЕС (1941‡1945)
31,че гевара штом бунтот ќе го изобличи власта бунтовникот за почести се граба и повторно се изделила каста а надежта за обнова е слаба но бродат негде пак бунтовни чети што глад и жедост ден и ноќ ги мачи ги шиба дождот во андите клети и над нив страшно ураганот јачи во таа бура да измие снага пак наивен да сети верба стара тој таму трга по позната трага но подемот е еден че гевара кој презрел докрај и привид и лага не живот веќе ами смрт тој бара,1941,1945,НОЌНА ПЕСНА,ОД СТАРИОТ НОТЕС (1941‡1945),ОД СТАРИОТ НОТЕС (1941‡1945)
32,пеперуга не водиш сметка ти за моите преданија не сакаш ни да знаеш пред кого сум јас обврзан во свеста и во восприемањето на светот ти си загрижена за својот углед и убавина не те занима тебе мојата семка од која нажалост сè произлегува ниту имаш верба во посебниот пристап кон виделото и мракот што можат да ти ветат тебе моите посебни агли на посматрање ти си уплашена за својот углед и убавина од некаде извира мојот порив спрема тебе и не можеш ти да не ја сетиш со копнеж свежината на таа струја но која бразда и да ја завлече не се спротивставуваш препалена за угледот и убавината во што ја сети тогаш длабината на оние црни корења што ме појат сè до спокојна сенка лете и дека шумолат гранките не само по волјата на ветрот при таков ужасен страв во што се состои твоето сакање викам застануваш како пеперуга на исушено дрво,1941,1945,НОЌНА ПЕСНА,ОД СТАРИОТ НОТЕС (1941‡1945),ОД СТАРИОТ НОТЕС (1941‡1945)
