,pesna,year_from,year_to,song_name,zbirka_name,podzbirka_name
101,одземање на силата pреpравен на pиtач gосpод gо pречека марка кралеtа крај pаtоt во една tорба беше ја збрал tежинаtа на сеtа земја синко сtар сум pоtкрени ми ја tорбава на рамо марко ја pодзеде со врвоt на коpјеtо и земјаtа се заtресе шtо сум сtорил јас си рече gосpод во себе и му ја осtави само tреtинаtа од силаtа народна леgенда ти што ми даде неимоверна сила да растам мускулесто како даб на глуждови да се израдувам млад од своето чаталење и листање да шалавам наивен ти што ми даде да сетам дека и земјата можам да ја поместам како орач што истава камен пред лемешот мој боже зошто се уплаши од мене зошто во непромислен страв ја измени својата првобитна намера зошто ми ја одзеде силата јас ти приоѓав во мислите како на родител што му се приоѓа идев во твојата дома со проста верба на дете што затрчано се враќа од играње да земе краешник од ноќвите јас те знаев свој закрепник усмевнат на мене задоволен од бистриот вир на мојата душа добродушно грижен и не можев да те замислам инаков а ти семоќен ти се престори на питач ти се облече во партали брашносани од просјачка торба ти си испиша на лицето мака на постанат старец слеп се направи да не ја забележам лукавоста скриена во твоите очи само подобро да ме подбидеш да ме купиш да ме премериш на кантар и после да ја покажеш сурово својата власт над мене мој боже зошто до толку се понижи за да ме поништиш мене не мислеше ли дека еден човек ќе сведочи за миг на твоја подла слабост ќе го гледа со горка потсмешливост дури и величието на небото во пролетна полноќ кога се ѕвездите јадри и обнадежни во тиха молитва безмилосен ти немаше мерка за моето унижување ти ме преполови а ми го остави чувството за мојата сила да бидам како пресушена подземна река во која темницата уште не е успокоена од татнежот на брановите потсмешлив ти ме направи прв во царштина што пропаѓа на лаѓа што тоне со товар на маки и гревови да крепам да спасувам а матната вода поклопува о сити се ти горе ти што ме роди бележан меѓу сите и што ме дари после ваков дар мој боже чади во твоите раце гламната со која ми ги подгоре крилата целата моја сушност се накрева против тебе моето срце те проколнува не чекам одговор од тебе унижен сеќавам сепак во мене нешто што те надминува што си го имал можеби но си го отуѓил кога нè создаде да откинеш од маката сам низ думани треба да го барам патот на мојот живот,1941,1945,ПЕСНАТА ЗА ЗАТВОРНИЦАТА,ОД СТАРИОТ НОТЕС (1941‡1945),ОД СТАРИОТ НОТЕС (1941‡1945)
102,тајна откриј ми една твоја тајна па макар колку мала и лесна јас ќе ја кријам во себе гробно дури не стане песна,1941,1945,ПЕСНАТА ЗА ЗАТВОРНИЦАТА,ОД СТАРИОТ НОТЕС (1941‡1945),ОД СТАРИОТ НОТЕС (1941‡1945)
103,готов е мостот убавец бодер наутро рано од сон се буди протега лак по лак наутро чуден гостин му иде од модер простор преку ридје сонцето единак сонцето голичко в река скака брвнува сето од лад и свежест на дно се нурка плива и шлака а мостот фрла од сенка мрежа и да го фане во неа сака вода се плиска роса се блиска смеа се гласи од бисер јасен над река трепка божилак и тогаш тајно по шините далечен трепет се носи нечуен стишен лек стине и трпне од немир мостот морници слатки го лазат премира чека одеднаш радосен вик ја раскина тишината горе зад полегат рид изрипа машината молскотен поглед на мостот метна зеде здив прилегна закопа за ржа и летна надолу се урна ги цепи шините бурно ги сече кривините напина гради ширина граба збива бодина лета размава развева грива и ете ја пред мостот шири раце тој со пискот на гради му се фрла го пали со здив го гали го свива го стега в железен преграб заглушит бурен само за миг и веќе напред в ширина јури јури со победен вик ој напред напред крај нема полетот лудува земјата разлава полето пука далечен глед,1941,1945,ПЕСНАТА ЗА ЗАТВОРНИЦАТА,ОД СТАРИОТ НОТЕС (1941‡1945),ОД СТАРИОТ НОТЕС (1941‡1945)
104,жртва о драги предмети о мили луѓе си мислам напати дај сè да срушам но вие велите жртвуј ја младоста вие ми велите и јас ве слушам,1945,1945,1,MOSTOT (1945) ПOЕМА,MOSTOT (1945) ПOЕМА
105,зборот чувај го зборот добро врзан како необучен коњ што знае да каса да клоца да мава чувај го зашто ако го пуштиш така разоглавен по чаирите којзнае која луда глава ќе посака да го јава,1945,1945,1,MOSTOT (1945) ПOЕМА,MOSTOT (1945) ПOЕМА
106,стебло паднатите лисја ги викаат тие што уште уплашени од неизвесноста на падот трепетат на дрвото дојдете долу да си умреме побегнете од ветриштата во приземна тишина нека остане гол тој јагленосан скелет да крши црни раце во просторот трупот нека му биде корито за водите на дождот есенски а ние густо ќе го обиколиме да не може да го пречекори кругот на своите жолтозлатни спомени,1945,1945,1,MOSTOT (1945) ПOЕМА,MOSTOT (1945) ПOЕМА
107,чудо толку ми е чудно што сме живееле уште почудно што сме сакале можеби сме сакале да го оправдаме чудото на живеењето тоа чудно чудо за да покажеме дека сме дораснати до она што како тајна заправо не ни припаѓа,1945,1945,1,MOSTOT (1945) ПOЕМА,MOSTOT (1945) ПOЕМА
108,ружа ружо со лисје како меки усни ти цутена на полјанка те следам те следам скришно девојченце мое и само гледам и само те гледам ружо јас сакам оној румен звук што во тебе се таи да го слушнам ружо јас сакам и ќе дојдам вечер ќе дојдам вечер скришем да те гушнам,1945,1945,1,MOSTOT (1945) ПOЕМА,MOSTOT (1945) ПOЕМА
109,студена скулптура искапи се во студ исплискај се со студ по лицето по вратот по сета снага да влезе студот в коски и под нокти со спици да станеш студен кип сталактит од мраз,1945,1945,1,MOSTOT (1945) ПOЕМА,MOSTOT (1945) ПOЕМА
110,распетие еднаш се давал тој род на подарок ти лозо моја лозо на одарот мизерна судбина сега еве ти осквернет крсту на меки кревети веќе со никого убаво не ти е мое загубено кутро распетие,1945,1945,1,MOSTOT (1945) ПOЕМА,MOSTOT (1945) ПOЕМА
111,осаменост ги изгубив собеседниците во себе ликовите на кои бев свикнат да им се обраќам да им доверувам најскришни работи да им покажувам колку сум духовит колку сум добар колку благороден готов да разберам сè а колку сепак страдам сега вртат глава од мене се прават да не ме слушаат уште не ми се врекнале но јас чувствувам дека им пречам им здодевам и нашата блискост им станува тешка глуво е во мене како во празна сала немам собеседници,1945,1945,1,MOSTOT (1945) ПOЕМА,MOSTOT (1945) ПOЕМА
112,кочо рацин од сонце вода и од пот се зачна на таа песна звукот скрит и таен музиката на мугри по ноќ мрачна и зборот толку свој и толку знаен а тоа сонце е припек на пладне над аргати што тутунот ги чека и нема сенка од негде да падне за капка вода утробата пека а таа вода е бистра и ладна а привкусот на таа пот е горок и со тој привкус на душата страдна се роди песна против гнет и порок и збор се зачу на закана задна а гласот беше на трагичен пророк,1945,1945,1,MOSTOT (1945) ПOЕМА,MOSTOT (1945) ПOЕМА
113,порака умирањето дури трае е сепак сè уште живот ни љубовта не е умрена дури ти уште сакаш макар некого друг поради сојот на трпките дури и туѓиот плод во твојата утроба ќе биде повеќе мое дете,1945,1945,1,MOSTOT (1945) ПOЕМА,MOSTOT (1945) ПOЕМА
114,лик достапни ми се ликовите машки од кои тврдост и суровост бие достапни ми се и муцките врашки со сета гроза што ја носат тие достапни ми се ги гледам со смешка но твојот лик е неизвесност тешка,1945,1945,1,MOSTOT (1945) ПOЕМА,MOSTOT (1945) ПOЕМА
115,странец тој заблудан беше а срцето врело што нејќе да знае и нејќе да слуша му омиле едно лажовито тело му омиле една лажовита душа а сега е морен магијата гине и сам си се чини пред себеси странец рамнодушна мисла низ умот му мине да оспори дури највозвишен занес но тој како милтон што жедно го слави на пролетта цутот а слеп стар и сломен презрениот лик го чека да се јави што сепак го вклучил во оплоден спомен,1945,1945,1,MOSTOT (1945) ПOЕМА,MOSTOT (1945) ПOЕМА
116,загубени браќа некогаш деца тргнале заедно да се качуваат како по стрмен рид а сега меѓу нив некаде на тој пат се крева непроѕирен ѕид другарчиња од детинските дни милни дечиња како да ги втаса таа судна мака да нема меѓу нив допир да нема ставување да не можат да си подадат рака и тие не смеат да си кажат ни збор за тоа што длабоко ги мачи за да не се загубат уште повеќе во светот што бучи и јачи и го сеќаваат својот најголем страв од збор и молба што може да си ги кажат и затоа молчат затоа сè забораваат и готови се себеси и друг да лажат браќа загубени уште се сакаат а сепак мислат дека си пречат и да се задржат уште малку во тоа сакање крајната болка нема да си ја речат,1945,1945,1,MOSTOT (1945) ПOЕМА,MOSTOT (1945) ПOЕМА
117,видот нека се мачи снагава и нека пати телово само нека ми светка виделцето виделово што дека гроздот дрочи штом не го гледаат очи што дека блеснала веда без око да ја гледа што би бил ридот без видот лесно е без огледало но тешко е без гледало,1945,1945,1,MOSTOT (1945) ПOЕМА,MOSTOT (1945) ПOЕМА
118,изненадување никогаш не ги забележуваме нијансите постепениот премин бавната подготовка на настаните каква промена вчудоневиден забележувам дека бујно расцутила како прекуноќ со жолт укит грмушката под мој прозорец дошла значи пролетта,1945,1945,1,MOSTOT (1945) ПOЕМА,MOSTOT (1945) ПOЕМА
119,таа ми пристапи а можеше уште поблиску таа не се плаши ни сосем да се привие таа е тело што бара незадржно галење,1945,1945,1,MOSTOT (1945) ПOЕМА,MOSTOT (1945) ПOЕМА
120,старата москва е тука сина приквечер на улиците слага јас минам кај што и ти си минел ме стега некаква тивка тага и еве срце ми сака на твојот гроб да дојдам над гробот твој да запрам во мисли потонат но нема кој да ми каже ти каде мир си нашол ти каде сон си заспал туѓинец непознат ти мајко наша попусто расна мажи со ѕвездено чело нивната младост в туѓина згасна и глува смрт им беше делот и мрак над споменот нивни се сипал и був над гробот им пискал а ноќе дождец есенски липал навевал ветрот лисја,1945,1945,1,MOSTOT (1945) ПOЕМА,MOSTOT (1945) ПOЕМА
121,песот песот што добро ме познавал соседот мој комшијата и ми се умилкувал толку пати со мавтање на опашката тој голем убав чист албинец бел пес што му стана сега во ова магливо утро да се нафрла на мене со жестоко лаење со оголување на блескавите песјаци зар толку си се впила во кожава зар толку лошотија да премине на мене од претходната ноќ во бесот да станам дури друг непознат човек за другарот за песот,1945,1945,1,MOSTOT (1945) ПOЕМА,MOSTOT (1945) ПOЕМА
122,спокој седам така вeќе долго и гледам пред мене езерото зад него планините за попладневно смирување зашто сонцето губи силина требаше да читам или зборови да редам а еве не правам ништо зошто така најпосле одвај разбирам дека сум се предал на милина,1945,1945,1,MOSTOT (1945) ПOЕМА,MOSTOT (1945) ПOЕМА
123,иднина каде е минатото минатото по кое пекаме и каде е иднината иднината што нема да ја дочекаме таа што ветува повев на житја кои допрва ќе се сеат таа што ветува допир на несмели раце и допир на усни што без нас ќе зреат,1945,1945,1,MOSTOT (1945) ПOЕМА,MOSTOT (1945) ПOЕМА
124,именден утре е водици името на татка ти студи кој знае дали пак некој наш ќе појде на гробишта да запали свеќа да му светне на домаќинот мој студи крв,1945,1945,1,MOSTOT (1945) ПOЕМА,MOSTOT (1945) ПOЕМА
125,гарване море црно пиле де лоша коба кобиш црни гласје носиш,1945,1945,2,MOSTOT (1945) ПOЕМА,MOSTOT (1945) ПOЕМА
126,претходница не барам збор за ова што ни се случува речи го предавство лудост гадост нискост секој ќе плати за својот бес пустошот што те чека јас веќе го доживеав не бој се не е страшно на крајот сеќаваш дури жал и блискост,1945,1945,2,MOSTOT (1945) ПOЕМА,MOSTOT (1945) ПOЕМА
127,спомен за славеј тој час мој заден спомен да би бидел јас тебе вишен славеј би те видел и оној килим по рудини твои со златест прелив на илјади бои би спомнил како со трепет сум пазел по таа убост леко да би газел на цветна лака се намерив скоро не цвеќе било девојчинско оро не цвеќе било малесорки вити со нивна лика гора лика кити тој час мој заден поглед да би бидел во сиња магла струга би ја видел од врвот вишен пред неврат да фатам о езеро јас поздрав ќе ти пратам,1945,1945,2,MOSTOT (1945) ПOЕМА,MOSTOT (1945) ПOЕМА
128,напуштеност тоа се сите песни во твојот живот чуени некогаш во присуство на љубовта тоа што сега го слушаш далеку негде триста хорови како да ги пеат на триста места а едновремено така ти иде до слухот тие пеат но сè потихо сè потихо сè потихо и подалеку до молк се гасат постепено испреметкани слики скипнува нагло сета музика во светот не слушаш веќе ништо,1945,1945,2,MOSTOT (1945) ПOЕМА,MOSTOT (1945) ПOЕМА
129,молитва за успокојување роб на грдата мисла пред пакости и злоби молитва правам да тивне гласот што несреќи коби барем во петлени зори или во глувите доби нека се смири малку јанѕата што ме здроби најдете спокојно место коскиве да ми ги зглоби,1945,1945,2,MOSTOT (1945) ПOЕМА,MOSTOT (1945) ПOЕМА
130,на една певица со некаква далечна желба твојата песна ја следиме твојата песна уверува дека уште нешто вредиме и таа песна в срце ќе ја чуваме затоа пеј да боледуваме,1945,1945,2,MOSTOT (1945) ПOЕМА,MOSTOT (1945) ПOЕМА
131,три крупни жени три крупни жени запливаа в езеро како три мазни риби под проѕирна вода три крупни жени повлекуваат три патеки со блесокот на рацете во ритмично движење со слаткиот порив на колковите со тајниот допир на градите што на водата причинува скокот го следам секој нивни замав со десната рака секој одбив со левата го следам тихиот ритам на двете писки на двете стапала на двете бутини под водата и макар да е запрено времето дури гледам тие се веќе далеку од мене тие се кајшто не можам да стигнам три крупни жени се вртат таму на грб да земат здив и да се починат нивниот поглед е сега упатен кон небото нивните снаги трепетат со морниците на езерото под сончев блесок како риби со паринките дури и нивната смеа допира до мене разбиена на зрнца како да држам сè дотаму распната невидлива мрежа со разбирлив трепет го чекам нивното враќање,1945,1945,2,MOSTOT (1945) ПOЕМА,MOSTOT (1945) ПOЕМА
132,велигденско јајце црвено за здравје црвено за радост црвено за среќа црвено бело здрав жив црвено бело по десното обравче црвено бело по левото да се закикоти од тој мазен скокот нашето машко дете а за нас помала тежина надеж и спомен на свежина ете,1945,1945,2,MOSTOT (1945) ПOЕМА,MOSTOT (1945) ПOЕМА
133,поетика јас песните ги берев од дрвото на животот како што селаните во ракотинци пред дуовден берат зрели цреши од црешовите дрвја,1945,1945,2,MOSTOT (1945) ПOЕМА,MOSTOT (1945) ПOЕМА
134,отпор поради силниот збор макар на непризнат јазик сè уште одбирам звуци на македонската лира тоа е мојот штит рамен на вашата сила силници зашто гробот со сите и вас ве збира спокојство глумам пред вас дури созвучја барам или тајновито име негде во нашиот предел тоа е мојот облог во морничавата игра тоа е мојата мисла упорно што сум ја следел,1945,1945,2,MOSTOT (1945) ПOЕМА,MOSTOT (1945) ПOЕМА
